id,name,networth,country,source,rank,age,citizenship,status,children,self_made,degree,university,longitude,latitude
618,Mark Walter,4.7,United States,finance,608,60,United States,Married,1,True,Bachelor of Arts/Science," Creighton University; Doctor of Jurisprudence, Northwestern University",-87.6244212,41.8755616
621,Patrizio Bertelli,4.6,Italy,luxury goods,622,75,Italy,Married,2,True,Master of Business Administration, University of Florence,9.1905,45.4668
622,Bert Beveridge,4.6,United States,vodka,622,59,United States,Married,3,True,Bachelor of Arts/Science, University of Texas at Austin,-97.74369950000001,30.2711286
624,Chen Lip Keong,4.6,Malaysia,"casinos, property, energy",622,73,Malaysia,Married,3,True,Medical Doctor, University of Malaya,104.9224426,11.568271
627,Tilman Fertitta,4.6,United States,"Houston Rockets, entertainment",622,63,United States,Married,4,True,Drop Out," Texas Tech University; Drop Out, University of Houston",-95.3676974,29.7589382
629,Peter Gassner,4.6,United States,software,622,56,United States,Married,2,True,Bachelor of Science, Oregon State University,-121.8746789,37.6624312
632,Denis O'Brien,4.6,Ireland,telecom,622,63,Ireland,Married,4,True,Master of Business Administration, Carroll School of Management,-6.2602732,53.3497645
633,Miuccia Prada,4.6,Italy,luxury goods,622,71,Italy,Married,2,False,Doctorate," University of Milan; Doctorate in Pedagogical Sciences, University of Milan",9.1905,45.4668
634,"Robert Rich, Jr.",4.6,United States,frozen foods,622,80,United States,Married,4,False,Master of Business Administration," Simon School of Business; Bachelor of Arts/Science, Williams College",-80.6278404,24.9242995
635,Abhay Vakil & family,4.6,India,paints,622,70,India,Married,3,False,Bachelor of Arts/Science," Bombay University; Bachelor of Arts/Science, Syracuse University",72.8773928,19.0759899
637,Ron Baron,4.5,United States,money management,638,77,United States,Married,2,True,Bachelor of Arts/Science, Bucknell University,-74.00601519999999,40.7127281
638,Andre Esteves,4.5,Brazil,banking,638,52,Brazil,Married,3,True,Bachelor of Arts/Science, Universidade Federal do Rio de Janeiro,-46.6333824,-23.5506507
641,Viatcheslav Kantor,4.5,Russia,"fertilizer, real estate",638,67,Russia,Married,5,True,Ph.D, Moscow Aviation University,-0.1276474,51.5073219
642,Min Kao & family,4.5,United States,navigation equipment,638,72,United States,Married,2,True,Bachelor of Arts/Science," National Taiwan University; Doctorate, University of Tennessee Knoxville; Master of Science, University of Tennessee Knoxville",-94.6169012,38.966673
644,Richard Li,4.5,Hong Kong,telecom,638,54,Hong Kong,Single,3,False,Drop Out, Stanford University,114.1628131,22.2793278
645,Rudolf Maag,4.5,Switzerland,medical devices,638,75,Switzerland,Married,2,True,Master of Business Administration, INSEAD,7.570077,47.53656
648,Igor Olenicoff,4.5,United States,real estate,638,78,United States,Married,2,True,Bachelor of Arts/Science," University of Southern California; Master of Business Administration, University of Southern California; Master of Science, University of Southern California",-80.08726540000001,26.275636
649,Sergei Popov,4.5,Russia,banking,638,49,Russia,Married,2,True,Bachelor of Arts/Science, Ural State Technical University,37.6174943,55.7504461
650,Thomas Pritzker,4.5,United States,"hotels, investments",638,70,United States,Married,3,False,Bachelor of Arts/Science," Claremont McKenna College; Doctor of Jurisprudence, University of Chicago; Master of Business Administration, University of Chicago",-87.6244212,41.8755616
651,"Julian Robertson, Jr.",4.5,United States,hedge funds,638,88,United States,Widowed,3,True,Bachelor of Arts/Science, University of North Carolina,-73.5940485,40.8791587
654,Shari Arison,4.4,Israel,Carnival Cruises,655,63,Israel,Divorced,4,False,Drop Out, Miami Dade College,34.7818064,32.0852997
655,Orlando Bravo,4.4,United States,private equity,655,50,United States,Married,3,True,Bachelor of Arts/Science," Brown University; Master of Business Administration, Stanford Graduate School of Business; Doctor of Jurisprudence, Stanford University",-80.13530059999999,25.7929198
658,Mark Cuban,4.4,United States,"online media, Dallas Mavericks",655,62,United States,Married,3,True,Bachelor of Arts/Science, Indiana University,-96.7968559,32.7762719
662,Michael Minhong Yu,4.4,China,education,655,59,China,Married,2,True,Bachelor of Arts/Science, Peking University,116.3912757,39.906217
666,Thomas Hagen,4.3,United States,insurance,665,85,United States,Widowed,2,False,Bachelor of Arts/Science, Ohio State University,-80.0852695,42.1294712
668,Rakesh Jhunjhunwala,4.3,India,investments,665,60,India,Married,3,True,B.Com," Bombay University; Chartered Accountant, The Institute of Chartered Accountants of India",72.8773928,19.0759899
670,Eric Lefkofsky,4.3,United States,Groupon,665,51,United States,Married,3,True,Bachelor of Arts/Science," University of Michigan; Doctor of Jurisprudence, University of Michigan",-87.75811880000001,42.1350268
673,Antony Ressler,4.3,United States,finance,665,59,United States,Married,3,True,Master of Business Administration," Columbia Business School; Bachelor of Arts/Science, Georgetown University",-118.242766,34.0536909
676,Steven Udvar-Hazy,4.3,United States,aircraft leasing,665,75,United States,Married,4,True,Bachelor of Arts/Science," University of California, Los Angeles",-118.3963062,34.0696501
677,Takao Yasuda,4.3,Japan,retail,665,72,Japan,Married,1,True,Bachelor of Arts/Science, Keio University,103.8194992,1.357107
678,Ye Chenghai & family,4.3,Hong Kong,pharmaceuticals,665,77,Hong Kong,Married,2,True,Bachelor of Arts/Science, Renmin University of China,114.1628131,22.2793278
680,Rick Caruso,4.2,United States,real estate,680,62,United States,Married,4,True,Doctor of Jurisprudence," Pepperdine University; Bachelor of Arts/Science, University of Southern California",-118.242766,34.0536909
681,Scott Cook,4.2,United States,software,680,68,United States,Married,3,True,Master of Business Administration," Harvard Business School; Bachelor of Arts/Science, University of Southern California",-122.2538557,37.4299388
685,Fu Liquan & family,4.2,China,surveillance equipment,680,53,China,Married,1,True,Bachelor of Arts/Science," Zhejiang Shuren University; EMBA, Zhejiang University",120.2052342,30.2489634
687,Tom Golisano,4.2,United States,payroll services,680,79,United States,Married,2,True,Associate in Arts/Science, SUNY Tech Alfred,-81.7954666,26.1452817
690,Ray Lee Hunt,4.2,United States,"oil, real estate",680,78,United States,Married,5,False,Bachelor of Arts/Science, Southern Methodist University,-96.7968559,32.7762719
698,Leonard Stern,4.2,United States,real estate,680,83,United States,Married,3,False,Master of Business Administration," Leonard N. Stern School of Business; Bachelor of Arts/Science, New York University",-74.00601519999999,40.7127281
704,Margot Birmingham Perot,4.1,United States,"computer services, real estate",705,87,United States,Widowed,5,False,Bachelor of Arts/Science, Goucher College,-96.7968559,32.7762719
705,David Bonderman,4.1,United States,private equity,705,78,United States,Married,5,True,Doctor of Jurisprudence," Harvard University; Bachelor of Arts/Science, University of Washington",-97.33274590000001,32.753177
706,Matthew Calkins,4.1,United States,software,705,48,United States,Divorced,2,True,Bachelor of Arts/Economics, Dartmouth College,-77.0709087,38.8959791
709,Dan Friedkin,4.1,United States,Toyota dealerships,705,56,United States,Married,4,False,Bachelor of Arts/Science," Georgetown University; Master of Business Administration, Rice University",-95.3676974,29.7589382
712,Hong Ra-hee,4.1,South Korea,Samsung,705,75,South Korea,Widowed,3,False,Bachelor of Arts/Science, Seoul National University,126.9782914,37.5666791
715,Daniel Kretinsky,4.1,Czechia,"energy, investments",705,45,Czechia,In Relationship,1,True,Law Degree, Masaryk University,14.4212535,50.0874654
717,Janice McNair,4.1,United States,"energy, sports",705,84,United States,Widowed,4,False,Bachelor of Arts/Science, Columbia College,-95.3676974,29.7589382
718,John Morris,4.1,United States,sporting goods retail,705,73,United States,Married,4,True,Bachelor of Arts/Science, Drury University,-93.2920373,37.2166779
719,Gabe Newell,4.1,United States,videogames,705,58,United States,Divorced,2,True,Drop Out, Harvard University,-122.3300624,47.6038321
722,Jon Stryker,4.1,United States,medical equipment,705,63,United States,Married,2,False,Bachelor of Arts/Science," Kalamazoo College; Master of Architecture, University of California, Berkeley",-74.00601519999999,40.7127281
723,Suh Kyung-bae,4.1,South Korea,cosmetics,705,58,South Korea,Married,2,False,Master of Business Administration," Samuel Curtis Johnson Graduate School of Management; Bachelor of Arts/Science, Yonsei University",126.9782914,37.5666791
725,Samuel Yin,4.1,Taiwan,retail,705,70,Taiwan,Married,2,False,Bachelor of Arts/Science," Chinese Culture University; Ph.D, National Chengchi University; Master of Business Administration, National Taiwan University",121.5636796,25.0375198
730,Igor Kesaev,4.0,Russia,"tobacco distribution, retail",727,54,Russia,Married,3,True,Bachelor of Arts/Science, Moscow Institute of International Relations,37.6174943,55.7504461
740,Ajay Piramal,4.0,India,pharmaceuticals,727,65,India,Married,2,False,Bachelor of Arts/Science," Bombay University; Master of Business Administration, Bombay University",72.8773928,19.0759899
742,Trevor Rees-Jones,4.0,United States,oil & gas,727,69,United States,Married,2,True,Bachelor of Arts/Science," Dartmouth College; Doctor of Jurisprudence, Southern Methodist University",-96.7968559,32.7762719
743,Ira Rennert,4.0,United States,investments,727,86,United States,Married,3,True,Bachelor of Arts/Science," Brooklyn College; Master of Business Administration, Leonard N. Stern School of Business",-74.00601519999999,40.7127281
753,Rafael Del Pino,3.9,Spain,construction,752,62,Spain,Divorced,6,False,Master of Business Administration," MIT Sloan School of Management; Bachelor of Arts/Science, Universidad  Politecnica de Madrid",-3.7035825,40.4167047
755,Rakesh Gangwal,3.9,United States,airline,752,67,United States,Married,1,True,Bachelor of Science in Engineering," Indian Institute of Technology; Master of Business Administration, University of Pennsylvania, The Wharton School",-80.19362,25.7741728
757,Jeff Greene,3.9,United States,"real estate, investments",752,66,United States,Married,3,True,Master of Business Administration," Harvard University; Bachelor of Arts/Science, Johns Hopkins University",-80.4494174,26.6279798
758,Johnelle Hunt,3.9,United States,trucking,752,89,United States,Widowed,2,True,Drop Out, University of Central Arkansas,-94.1574328,36.0625843
761,"Stephen Mandel, Jr.",3.9,United States,hedge funds,752,65,United States,Married,3,True,Bachelor of Arts/Science," Dartmouth College; Master of Business Administration, Harvard University; Diploma, Phillips Academy Exeter",-73.6284598,41.0264862
765,Robert Rowling,3.9,United States,"hotels, investments",752,67,United States,Married,2,False,Doctor of Jurisprudence," Southern Methodist University; Bachelor of Arts/Science, The University of Texas at Austin",-96.7968559,32.7762719
768,Ben Silbermann,3.9,United States,Pinterest,752,38,United States,Married,2,True,Bachelor of Arts/Science, Yale University,-122.419906,37.7790262
774,Euisun Chung,3.8,South Korea,Hyundai,775,50,South Korea,Married,2,False,Bachelor of Arts/Science," Korea University; Master of Business Administration, University of San Francisco",126.9782914,37.5666791
775,Daniel D'Aniello,3.8,United States,private equity,775,74,United States,Married,2,True,Master of Business Administration," Harvard University; Bachelor of Arts/Science, Syracuse University",-77.2651762,38.9013729
776,Oleg Deripaska,3.8,Russia,"aluminum, utilities",775,53,Russia,Divorced,2,True,Bachelor of Arts/Science, Moscow State University,37.6174943,55.7504461
778,Feng Hailiang,3.8,China,"copper, education",775,60,China,Married,2,True,Master of Business Administration, Zhejiang University,120.1805427,29.7296617
779,John Gandel,3.8,Australia,shopping malls,775,86,Australia,Married,4,False,Doctorate, Monash University,144.960964,-37.8077694
780,Gao Dekang & family,3.8,China,apparel,775,69,China,Married,3,True,EMBA, Phoenix International University,120.7480757,31.6572954
781,Jaime Gilinski Bacal,3.8,Colombia,banking,775,63,Colombia,Married,4,False,Master of Business Administration, Harvard Business School,-0.1276474,51.5073219
784,"Amos Hostetter, Jr.",3.8,United States,cable television,775,84,United States,Married,3,True,Bachelor of Arts/Science," Amherst College; Master of Business Administration, Harvard University",-71.0582912,42.3602534
787,Aerin Lauder,3.8,United States,cosmetics,775,51,United States,Married,2,False,Bachelor of Arts/Science, University of Pennsylvania,-74.00601519999999,40.7127281
800,Donald Sterling,3.8,United States,real estate,775,87,United States,Married,3,True,Bachelor of Arts/Science," California State Los Angeles; Doctor of Jurisprudence, Southwestern Law School",-118.3963062,34.0696501
802,Don Vultaggio & family,3.8,United States,beverages,775,69,United States,Married,2,True,High School Graduate, High School,-73.681282,40.8254914
807,Marian Ilitch,3.7,United States,Little Caesars,807,88,United States,Widowed,7,True,Diploma," High School; High School Graduate, High School",-83.27326429999999,42.515868
811,Mary Alice Dorrance Malone,3.7,United States,Campbell Soup,807,71,United States,Divorced,2,False,Bachelor of Arts/Science, University of Arizona,-75.8238355,39.9831616
812,Michael Milken,3.7,United States,investments,807,74,United States,Married,3,True,Bachelor of Arts/Science," University of California, Berkeley; Master of Business Administration, University of Pennsylvania, The Wharton School",-118.242766,34.0536909
813,Ronald Perelman,3.7,United States,leveraged buyouts,807,78,United States,Married,8,True,Bachelor of Arts/Science," University of Pennsylvania; Master of Business Administration, University of Pennsylvania, The Wharton School",-74.00601519999999,40.7127281
815,J. Joe Ricketts & family,3.7,United States,TD Ameritrade,807,79,United States,Married,4,True,Bachelor of Arts/Science, Creighton University,-110.4436629,43.684017
817,Jeff Rothschild,3.7,United States,Facebook,807,66,United States,Married,3,True,Bachelor of Arts/Science," Vanderbilt University; Master of Science, Vanderbilt University",-122.1598465,37.4443293
818,David Rubenstein,3.7,United States,private equity,807,71,United States,Divorced,3,True,Bachelor of Arts/Science," Duke University; Doctor of Jurisprudence, University of Chicago",-77.0941675,38.9843774
820,Steven Spielberg,3.7,United States,movies,807,74,United States,Married,7,True,Bachelor of Arts/Science, California State Long Beach,-118.5264706,34.0480643
821,Barry Sternlicht,3.7,United States,private equity,807,60,United States,Married,3,True,Bachelor of Arts/Science, Brown University,-80.19362,25.7741728
822,Mark Stevens,3.7,United States,venture capital,807,61,United States,Married,3,True,Master of Business Administration," Harvard University; Bachelor of Arts/Science, University of Southern California; Master of Science, University of Southern California",-106.8317359,40.4848003
824,Vincent Viola,3.7,United States,electronic trading,807,65,United States,Married,3,True,Doctor of Jurisprudence," New York Law School; Bachelor of Arts/Science, United States Military Academy",-74.00601519999999,40.7127281
826,Wang Roger,3.7,United States,retail,807,72,United States,Married,2,True,Bachelor of Arts/Science," Chinese Culture University; Master of Business Administration, Southeastern Louisiana University",118.7916458,32.0609736
832,Leonid Boguslavsky,3.6,Russia,venture capital,831,69,Russia,Married,4,True,Master of Science, Moscow Institute for Transport Engineering,37.6174943,55.7504461
833,"Austen Cargill, II.",3.6,United States,Cargill,831,70,United States,Divorced,2,False,Doctorate," Oregon State University; Bachelor of Arts/Science, University of Minnesota; Master of Science, University of Minnesota",-110.52926,45.671445
836,Steve Conine,3.6,United States,online retail,831,48,United States,Married,3,True,Bachelor of Science in Engineering, Cornell University,-71.0582912,42.3602534
838,S. Curtis Johnson,3.6,United States,cleaning products,831,66,United States,Married,4,False,Bachelor of Arts/Science," Cornell University; Master of Business Administration, Kellogg School of Management",-87.7825242,42.7260523
839,Helen Johnson-Leipold,3.6,United States,cleaning products,831,64,United States,Married,5,False,Bachelor of Arts/Science, Cornell University,-87.7825242,42.7260523
840,Daryl Katz,3.6,Canada,pharmacies,831,59,Canada,Married,2,True,Bachelor of Arts/Science," University of Alberta; Doctor of Jurisprudence, University of Alberta",-113.507996,53.535411
841,Peter Kellogg,3.6,United States,investments,831,78,United States,Married,3,False,Bachelor of Arts/Science, Babson College,-74.3254271,40.7478786
842,Samuel Tak Lee,3.6,Hong Kong,real estate,831,82,Hong Kong,Married,7,False,Master of Business Administration," Harvard Business School; Bachelor of Arts/Science, Massachusetts Institute of Technology",114.1628131,22.2793278
844,Marianne Liebmann,3.6,United States,Cargill,831,67,United States,Married,2,False,Bachelor of Arts/Science, Montana State University,-111.044047,45.6794293
845,Winifred J. Marquart,3.6,United States,cleaning products,831,62,United States,Married,4,False,Drop Out, Cornell University,-75.9774183,36.8529841
846,Daniel Och,3.6,United States,hedge funds,831,60,United States,Married,3,True,Bachelor of Arts/Science," University of Pennsylvania, The Wharton School",-80.13530059999999,25.7929198
847,Anthony Pritzker,3.6,United States,"hotels, investments",831,60,United States,Married,6,False,Bachelor of Arts/Science, Dartmouth College,-118.242766,34.0536909
848,Rodger Riney & family,3.6,United States,discount brokerage,831,75,United States,Married,3,True,Bachelor of Arts/Science," University of Missouri; Master of Business Administration, University of Missouri",-90.1998378,38.6264178
849,Niraj Shah,3.6,United States,online retail,831,47,United States,Married,2,True,Bachelor of Science in Engineering, Cornell University,-71.0582912,42.3602534
853,Richard Tsai,3.6,Taiwan,finance,831,63,Taiwan,Married,2,False,Master of Business Administration," Leonard N. Stern School of Business; Graduate, National Taiwan University",121.5636796,25.0375198
857,Zhang Hongwei,3.6,China,"oil, banking",831,66,China,Married,3,True,Bachelor of Arts/Science," Harbin Engineering University; Master of Science, Harbin Institute of Technology",116.3912757,39.906217
858,Andrej Babis,3.5,Czechia,agriculture,859,66,Czechia,Married,4,True,Master, University of Economics in Bratislava (UEB),14.4212535,50.0874654
860,Hubert Burda,3.5,Germany,publishing,859,81,Germany,Married,2,False,Bachelor of Arts/Science, Ludwig Maxmilian University,11.5753822,48.1371079
861,Chuchat Petaumpai & Daonapa Petampai,3.5,Thailand,motorcycle loans,859,67,Thailand,Married,2,True,Bachelor of Arts/Economics, Oklahoma State University,100.4930399,13.7544238
862,Charles Cohen,3.5,United States,real estate,859,69,United States,Married,4,False,Doctor of Jurisprudence," Brooklyn Law School; Bachelor of Arts/Science, Tufts University",-74.00601519999999,40.7127281
863,David Filo,3.5,United States,Yahoo,859,55,United States,Married,1,True,Master of Science," Stanford University; Bachelor of Arts/Science, Tulane University",-122.1598465,37.4443293
864,Sergei Galitsky,3.5,Russia,retail,859,53,Russia,Married,1,True,Bachelor of Arts/Science, Kuban State University,38.9764814,45.0352566
867,Martha Ingram & family,3.5,United States,"book distribution, transportation",859,85,United States,Widowed,4,False,Bachelor of Arts/Science, Vassar College,-86.7743531,36.1622296
868,H. Fisk Johnson,3.5,United States,cleaning products,859,62,United States,Divorced,1,False,Bachelor of Arts/Science," Cornell University; Doctorate, Cornell University; Master of Science, Cornell University; Master of Business Administration, Samuel Curtis Johnson Graduate School of Management",-87.7825242,42.7260523
870,Lim Wee Chai,3.5,Malaysia,rubber gloves,859,63,Malaysia,Married,2,True,Master of Business Administration," Sul Ross State University; Bachelor of Arts/Science, University of Malaya",101.6942371,3.1516964
875,N.R. Narayana Murthy,3.5,India,software services,859,74,India,Married,2,True,Master of Science, Indian Institute of Technology,77.59129969999999,12.9791198
876,John Paulson,3.5,United States,hedge funds,859,65,United States,Married,2,True,Master of Business Administration," Harvard Business School; Bachelor of Arts/Science, New York University",-74.00601519999999,40.7127281
877,J.B. Pritzker,3.5,United States,"hotels, investments",859,56,United States,Married,2,False,Bachelor of Arts/Science," Duke University; Doctor of Jurisprudence, Northwestern University",-89.6439575,39.7990175
878,Michael Rubin,3.5,United States,online retail,859,48,United States,Divorced,1,True,Drop Out, Villanova University,-75.30462989999999,40.0198335
880,Thomas Secunda,3.5,United States,Bloomberg LP,859,66,United States,Married,2,True,Bachelor of Arts/Science, SUNY Binghamton,-73.8901688,41.2083836
881,Vivek Chaand Sehgal,3.5,Australia,auto parts,859,64,Australia,Married,2,True,Bachelor of Arts/Science, Delhi University,77.2219388,28.6517178
883,Leena Tewari,3.5,India,pharmaceuticals,859,63,India,Married,2,False,B.Com," Bombay University; Master of Business Administration, Boston University",72.8773928,19.0759899
885,Romesh T. Wadhwani,3.5,United States,software,859,73,United States,Married,1,True,Doctorate," Carnegie Mellon University; Master of Science, Carnegie Mellon University; Bachelor of Arts/Science, Indian Institute of Technology, Bombay",-122.1598465,37.4443293
893,"William Conway, Jr.",3.4,United States,private equity,891,71,United States,Married,1,True,Bachelor of Arts/Science, Dartmouth College,-77.1776327,38.9342888
894,Jim Davis,3.4,United States,staffing & recruiting,891,77,United States,Married,2,True,Bachelor of Arts/Science, Middlebury College,-71.2092214,42.3370414
896,Ennio Doris & family,3.4,Italy,financial services,891,80,Italy,Married,2,True,Diploma, High School,11.8304219,45.6470275
898,Alexander Frolov,3.4,Russia,"mining, steel",891,56,Russia,Married,1,True,Doctorate, Moscow Institute of Physics and Technology,37.6174943,55.7504461
899,Fiona Geminder,3.4,Australia,manufacturing,891,56,Australia,Married,4,False,Bachelor of Arts/Science," Monash University; LLB, Monash University",144.960964,-37.8077694
901,Viktor Kharitonin,3.4,Russia,pharmaceuticals,891,48,Russia,Married,2,True,Bachelor of Arts/Science, Novosibirsk State University,37.6174943,55.7504461
903,Chris Larsen,3.4,United States,cryptocurrency,891,60,United States,Married,2,True,Bachelor of Arts/Science," San Francisco State University; Master of Business Administration, Stanford Graduate School of Business",-122.419906,37.7790262
904,Angela Leong,3.4,Hong Kong,casinos,891,60,Hong Kong,Widowed,5,False,Diploma, High School,114.1628131,22.2793278
906,John Middleton,3.4,United States,tobacco,891,66,United States,Married,2,False,Bachelor of Arts/Science," Amherst College; Master of Business Administration, Harvard University",-75.30462989999999,40.0198335
908,Arturo Moreno,3.4,United States,"billboards, Anaheim Angels",891,74,United States,Married,3,True,Bachelor of Arts/Science, University of Arizona,-112.0741417,33.4484367
909,God Nisanov,3.4,Russia,real estate,891,49,Russia,Married,3,True,Diploma, Baku Institute of Law,37.6174943,55.7504461
913,Patrick Ryan,3.4,United States,insurance,891,83,United States,Married,3,True,Bachelor of Arts/Science, Northwestern University,-87.7365286,42.1080703
915,Lynn Schusterman,3.4,United States,"oil & gas, investments",891,82,United States,Widowed,3,False,Drop Out, University of Miami,-95.9929113,36.1556805
917,Daniel Tsai,3.4,Taiwan,finance,891,65,Taiwan,Married,4,False,LLM," Georgetown University; LLB, National Taiwan University",121.5636796,25.0375198
918,Tung Chee Chen,3.4,Hong Kong,shipping,891,78,Hong Kong,Married,2,False,Master of Science," Massachusetts Institute of Technology; Bachelor of Arts/Science, University of Liverpool",114.1628131,22.2793278
920,Frank VanderSloot,3.4,United States,"nutrition, wellness products",891,72,United States,Married,14,True,Bachelor of Arts/Science, Brigham Young University,-112.0401206,43.4935589
921,Kelcy Warren,3.4,United States,pipelines,891,65,United States,Married,1,True,Bachelor of Arts/Science, University of Texas Arlington,-96.7968559,32.7762719
923,Vladimir Yevtushenkov,3.4,Russia,"telecom, investments",891,72,Russia,Married,2,True,Bachelor of Arts/Science," Mendeleyev Chemical Engin; Master of Science, Moscow State University",37.6174943,55.7504461
924,Somphote Ahunai,3.3,Thailand,renewable energy,925,53,Thailand,Married,3,True,Master of Business Administration, Joseph M. Katz Graduate School of Business,100.4930399,13.7544238
925,John Arnold,3.3,United States,hedge funds,925,47,United States,Married,2,True,Bachelor of Arts/Science, Vanderbilt University,-95.3676974,29.7589382
931,Senapathy Gopalakrishnan,3.3,India,software services,925,66,India,Married,1,True,Master of Science, Indian Institute of Technology,77.59129969999999,12.9791198
932,B. Wayne Hughes,3.3,United States,self storage,925,87,United States,Divorced,2,True,Bachelor of Arts/Science, University of Southern California,-84.4970393,38.0464066
934,Samvel Karapetyan,3.3,Russia,real estate,925,55,Russia,Married,3,True,Bachelor of Arts/Science, Yerevan Polytechnic Institute,37.6174943,55.7504461
